{"schemaVersion":2,"kind":"hvp-native-dependency-graph","approvedNodeIds":["mpv","ffmpeg","libplacebo","libass","spirv-cross","glslang","fast-float","freetype","fribidi","harfbuzz","zlib","jinja","markupsafe"],"nodes":[{"id":"mpv","source":"mpv","linkType":"shared","dependsOn":["ffmpeg","libplacebo","libass"]},{"id":"ffmpeg","source":"ffmpeg","linkType":"shared","dependsOn":["zlib"]},{"id":"libplacebo","source":"libplacebo","linkType":"shared","dependsOn":["spirv-cross","glslang","fast-float","jinja","markupsafe"]},{"id":"libass","source":"libass","linkType":"shared","dependsOn":["freetype","fribidi","harfbuzz"]},{"id":"spirv-cross","source":"spirv-cross","linkType":"shared","dependsOn":[]},{"id":"glslang","source":"glslang","linkType":"shared","dependsOn":[]},{"id":"fast-float","source":"fast-float","linkType":"header-only","dependsOn":[]},{"id":"freetype","source":"freetype","linkType":"shared","dependsOn":["zlib"]},{"id":"fribidi","source":"fribidi","linkType":"shared","dependsOn":[]},{"id":"harfbuzz","source":"harfbuzz","linkType":"shared","dependsOn":[]},{"id":"zlib","source":"zlib","linkType":"shared","dependsOn":[]},{"id":"jinja","source":"jinja","linkType":"build-only","dependsOn":["markupsafe"]},{"id":"markupsafe","source":"markupsafe","linkType":"build-only","dependsOn":[]}]}
